sentence1,label
"it gets pretty noisy when the fan kicks in, but heat kills computers so you have to live with a certain amount of it.",0
construction quality is strong and materials feel high quality,0
mine arrived quickly and in fine shape,0
"It is really sleek, the design is amazing, loved every physical aspect of it.",0
The touchscreen every so often wouldn’t respond.,0
I love the keyboard and how you can change the color of every individual key,0
The sound is good for a laptop of this size.,0
I am particularly impressed with the build quality and the attention to little details,0
The Bluetooth connectivity is nice.,0
One of the RGB lights where the fans are not lighting up,0
"Some keys are 'sticky' and stay depressed, especially the peripheral keys which aren't used much",0
"The sound is exemplary, with the Bang & Olufsen speakers.",0
the track pad is accurate and never seems to be over sensitive or get in the way,0
The specs of the computer are great and it is fast and snappy.,0
"This is a fast, well-optioned machine inside",0
"Elegant, sleek design, gorgeous 4K display and it's very powerful for an Ultrabook.",0
"When you hit the function key, the function keys light up which is a cool touch.",0
The battery never seems to reach 100%,0
"Aorus 15 does look and feel a little bulky, weighing a little over 5 pounds and nearly measuring at 1 inch thick.",0
I don't especially like is the placement of the power button on the keyboard as if it was just another key.,0
"The screen is vibrant with Full HD Widescreen , 14” viewing, and two speakers",0
"This one is a good size, well placed with good buttons.",0
The specs for this machine are pretty high up there for such a sleek form factor.,0
Little heavy not sure if I have a screen protector that would be a bummer afraid to to take off temporary.,0
It is completely modern and efficient computer.,0
The battery can stay alive up to 7 hours depends on how you doing with it.,0
"I've owned this laptop for almost exactly a year now, and it has served me very well.",0
the fingerprint scanner didn’t read until after a few attempts.,0
"Even though the heat does not reach high temperatures, the noise is loud enough to cover even the highest volume coming from the game.",0
A little to the downside is that it doesn't come with a lot of ports on the side,0
The speaker grills can easily be dented.,0
"the surface of the keyboard, palmrest and touchpad are great because they are NOT fingerprint magnets.",0
This laptop is noticeably faster at everything and the screen is superior.,0
It arrived very quickly and came packaged in a beautiful black box with the msi logo in gold.,0
Excellent quality of components and construction,0
Battery life was descent.,0
This laptop is great for school and work.,0
the battery does not last more than a couple hours under heavy game use.,0
"there's no left windows key, which is kinda annoying.",0
Computer froze and made a loud constant noise so I shut it down manually.,0
"I tried to contact them 2 times by phone, 3 times trough chat and 7 times trough e-mail and no acknowledge of a problem, estimate on when my laptop will be sent back or anything else.",0
Having the ability to change fan speed is great because it can help save the computer from damage in the long run.,0
"I use it primarily for gaming, and the refresh rate of the screen is INSANE",0
"It's light, has very good specs, and the 144hz screen is great.",0
this computer boots up rather quickly.,0
"Considering the screen size, it is easy to lift.",0
The keyboard has good feeling with decent travel distance while typing.,0
It is super powerful and runs all games great,0
Very easy process and a clean installation of Windows 10 with no weird BIOS crashes or anything like that,0
"The computer is an Intel Core i7, so you know it is going to be fast and powerful",0
Easy to change backlit keyboard colors etc and overall solid construction.,0
The mousepad is smooth to work with,0
it has a mode where it will use 50% of the battery and then start to charge to prolong battery life.,0
Maybe a laptop with multiple foldable screens which can be combined to form a bigger one will be the solution.,1
the alternate keys now light up so you can see them in the dark,0
It's very light in the hand for its screen size.,0
"The laptop's monitor is high quality, and the high refresh rate makes watching live sports or gaming look great",0
The Omen takes around 10 seconds to startup into Window 10!,0
The keyboard is very nice with a quiet yet tactile feel to it.,0
it does get hot if using it in your lap and would be impossible to game with it in lap.,0
"drivers were old, on a laptop that was *just* released in the last few weeks.",0
The touchpad is very fussy about where you press it to get a left click or a right-click.,0
It does get pretty hot though when gaming so I am not sure of it’s longevity.,0
"The GS75 is a very powerful laptop that is surprisingly light weight, it has strong build quality and it look good to be honest.",0
"I was looking for something light, small, and can handle anything I throw at it, while looking professional when doing it",0
The fingerprint recognizer is amazingly good and fast,0
"Some months ago, the fan speed started to behave like crazy",0
Nice 'seamless' workflow options if you also have a Galaxy Phone,0
it manages to balance the cool factor of being a gaming laptop,0
did not come in its hard wooden case and with the laptop sleeve.,0
"Some of the reviews mention the touch screen, which this one does not have",0
the back-lighting on the keyboard was not working.,0
It is a constant swooshing sound that's very clearly audible in a quiet room.,0
"when opening the screen one-handed, the bottom half (more or less) stays flat on the table.",0
They had a beautiful aluminum case and were super thin.,0
"good sound, touch screem and super light",0
Biggest drawback is the lack of touchscreen,0
4k display is truly beautiful,0
Great performer and excellent build quality.,0
I Wish it came with upgrade options such as 1TB SSD and 32gb ram,0
the USB's weren't in a very intuitive position,0
Quality of the LCD is the best I have seen in a laptop to date,0
The contrast ratio and blacks really make the display pop.,0
One thing that disappointed me is that in Windows Power Options there is no way to change to high performance.,0
It would be fantastic if the laptop has a projector.,1
tracking is good and smooth,0
The screen is really amazing.,0
The screen looks super nice with brilliant color.,0
Programs run quick and windows takes seconds to boot up,0
It won't power on if unplugged and immediately shuts down if unplugged,0
SSD size was a bit small at 256GB,0
"when in sleep mode, the computer sometimes refuses to power on its screen, meaning you have to restart the entire thing to wake it up.",0
The processor is a bit slow,0
The power button LED is blaring super bright red,0
there is pretty massive screen backlight bleed in the corners,0
"With general working, emails, internet, etc the battery will easily last 5+ hours.",0
The touchpad works very well which surprised me.,0
it can be a little loud when the gpu kicks in,0
The touch pad is on the right of the keyboard and doubles as the numeric pad. It feels narrow and awkward,0
"This laptop has amazingly good build quality, and is very snappy to use.",0
there were minor glitches when setting it up such as the hard drive being in two partitions and NVIDIA Ge-force Experience had to be uninstalled and reinstalled for it to work properly.,0
"the LED's are a bit bright and hard to look at, and the font used for the keys can be difficult to read at a glance.",0
The front camera is a embarrassment for a $1200 laptop,0
The screen is clear and crisp,0
The visual display is awesome and very clear and bright.,0
"It looks sleek, has amazing battery life, and more horsepower than my old desktop.",0
"17+” of Smooth 144hz refresh rate. Back lid made of aluminum, really thin plastic bezels with a 1” chin",0
Using the keyboard this way for just a couple of days started hurting my thumb,0
Most navigational keys are placed in strange places.,0
"I emailed customer service and after initial info requests, there was no further response and it has been two weeks.",0
"It comes with a backlit keyboard, a great convenience when the surrounding light is not the best.",0
the paint could get scratched easily,0
powerful and very light compared to other full laptop RTX cards.,0
The Intel core and the windows 10 are very fast,0
I'm just blown away by this design and how much power this thing packs,0
"build quality is fantastic, VERY VERY solid machine.",0
The processing power is a good bang for the buck with an intel 8th gen i7,0
The flipped motherboard was a great choice,0
The touch screen is very responsive and having the included pen to use is a great extra for many apps.,0
The build quality is leaps and bounds higher. Virtually no deck flex and feels super solid.,0
The fans are loud like most laptops. Its so loud it disturbs others in the same room.,0
Starting the PC up and getting running only takes seconds.,0
THE TABLET IS EASY TO USE AND THE BATTERY IS GOOD,0
Only had this for a few hours since it was a gift for someone and I wanted to make sure it worked.,0
Fans can get quite loud.,0
I think the M.2 SSD Slot is very useful,0
I am having a lot of fun designing keyboard light layouts,0
I received the laptop very quickly.,0
The power port location was a bit awkward since it was on the right side in the middle,0
the coil whine in this machine is considerably worse than the coil whine in the previous machine I owned,0
Magnetic keycaps to quickly switch hotkeys,1
this laptop exceeded my expectations and is definitely worth the price.,0
The external lights are subtle,0
When I turned this thing on it was nearly instant.,0
the fans get quite loud at load,0
The fingerprint scanner is an added bonus to login,0
started crashing randomly turning black screen and forcing me to press the battery reset bottom on the bottom of the laptop.,0
The HP Omen laptop is a well constructed and capable laptop that includes one of the latest generations of Nvidia RTX2060 GPU’s.,0
it is gorgeous and the all-aluminum body is outstanding!!!,0
The RGB backlight for the keyboard is very bright. I like it on the lowest of 11 settings that can be controlled with the function keys.,0
The speakers are good and will let you hear things well even outside,0
Not as responsive as anticipated.,0
several keys allow a VERY LIMITED amount of light through so F1-F12 buttons are not actually visible with the illumination.,0
Got to set up the RGB lighting of the keyboard and it was so pleasing to see while typing this review,0
Lots of lag and slow response from the computer,0
you have many expansion options with the Thunderbolt 3/USB-C port.,0
the fingerprint reader stops working,0
"it's a solid feeling machine, and a suave looking one.",0
Extremely powerful and aesthetic computer that boasts the newest 144hz screen which is incredible when gaming.,0
The fan was initially startling loud,0
this replacement unit has way more backlight bleeding than the previous one,0
it is light and this feature is very important for me since I carry it to school with me.,0
I like the touchscreen,0
Fully patched and updated with Asus' drivers (which also had very bad installers) and still crashed intermittently.,0
speakers crackle and have not been sounding good to me,0
"After using the touch screen for severalonutes, the cursor is not available and computer has to be restarted for it to work again.",0
The laptop softly whispered in my ears via the sound jack at crisp quality only a laptop of this mangitutde can provide.,0
The SSD is expandable if you're willing to take a heat gun to it and open it up,0
Super thin and light weight and plays all the games I play with ease.,0
First one I received the laptop battery didn’t work properly,0
Nice sound quality when playing skyrim se with 100s of mods.,0
"the feel of it is quite nice, and it is a very svelte form factor.",0
they included bloatware that you can't uninstall,0
the GPU runs pretty cool,0
wouldn't get past the Blue Setup Screen,0
"A wobbly scree-view that has the image ""dancing"" at the slightest touch",0
"its nice, compact and powerful for on the go assignments and gaming.",0
There is a game port that makes your game run beautiful on external monitor.,0
"This comes with a very nice 512 GB SSD, and it's an M.2 drive which means it's crazy fast.",0
It also takes quite a while upon start up.,0
the cpu in this machine is not capable of meeting many games required specs.,0
extrimly happy with screen quality and it preformance,0
It is lightning fast and the gaming power inside makes for an all around great laptop that is worth every penny,0
This is the best trackpad on a Windows machine that you're going to find.,0
"can easily adjust most of your settings from Dragon Center; fans, color/display, keyboard.",0
When I received my computer the gold trim and individual RGB lighting was breath taking,0
it would be nice if the screen could fold back or rotate so it could be used more like a tablet,0
"Small hard drive, only 256GB which is kinda useless",0
"I had instances where the laptop overheated while playing ""Overwatch"" and I checked the temperature via Armoury Crate and it was at 94% and the laptop itself was very hot when I touched it.",0
I attempted Windows setup and one of my keys half fell-off.,0
The RGB on presets alone on the keyboard are impressive,0
It has a gorgeous touch screen,0
once the heat kicks in there will be frame drops.,0
Comes with lots of bloatware,0
"A human being, that speaks my language, answered my call in less than 5 minutes and was very knowledgeable and understood what I was dealing with.",0
Mild coil whine but it's usually just when it's on Gaming/creator mode.,0
"It is also light weight compare to my MSI 17"". I am definitely brag and encourage gamers and videographers to invest in this machine",0
"The laptop boots up quickly, operates great and works without issues of any kind that I can see.",0
"this is a very decent, very beautiful ultrabook and i especially love the mix of materials and color choice- it looks classy, business and professional.",0
"the battery life is good, and it's not too heavy, it should also be a great all-around laptop.",0
it is light weight and easy to use in your lap for day to day work.,0
its thin and its lightweigh,0
"As sustainability becomes increasingly important, computers with built-in environmental sensors could monitor factors such as temperature, air quality, and energy consumption. These computers could provide real-time feedback, suggest energy-saving measures, and contribute to a more eco-friendly computing ecosystem.",1
Key cap feels and response better than I expect.,0
"The sound is tinny, which is unforgivable considering how huge the speaker grills are",0
I only have one negative thing to say so far and that is that it is a fingerprint magnet.,0
144hz refresh rate is awesome for portable gaming,0
The FPS is extremely disappointing for what it is. BFV i would get an average FPS of 70-80 on medium settings.,0
A technician at Asus damaged my notebook and they are blaming it on me.,0
"The build of the MSI screen was disappointingly flimsy and I feel that I could one day break this thing if I opened the screen the wrong way, especially with one hand.",0
my laptop cant connect to internet,0
I love the tactile feel and the fact that it is still a real laptop that can be upgraded easily.,0
The 144hz display is extremely crisp and smooth,0
The only thing missing is touchscreen capability,0
Super fast and gaming is a breeze.,0
"It is also surprisingly easy to write on, the pen has a feel almost like writing on paper with a little bit of grab so the pen is not just sliding.",0
"It performs like a desktop, and its mobility is awesome.",0
three zone RGB is awesome.,0
Heat management is quite good. I hovered around 70-75/C after a couple of hours of gaming.,0
two important keys are not working,0
It wont recognize a 1tb m.2 drive at all,0
The colors are vivid and accurate.,0
A curved space bar for more comfortable typing,1
It has a gorgeous design and it runs so smoothly,0
The performance is great and the keyboard and display are very good.,0
the wireless card also has connection issues when the driver updates to the newest version which will prevent you from connecting to any network.,0
I was unable to adjust the backlighting on the SteelSeries keyboard before updating the SteelSeries Engine 3 software several times,0
All sides are metal (even the vent grills) and when you first lift it you instantly know it's built like a tank.,0
"I was pleasantly surprised to encounter a light weight, very versatile and downright peppy performance on this new model.",0
"very light weight and powerful , the sleek steel series gaming keyboard is great as well.",0
The dedicated GPU is very basic but can handle most things you throw at it,0
The screen is responsive and fairly quick at registering my touches,0
"I love typing on this keyboard, visually the RGB is stunning, and this laptop cruises.",0
"Drivers don't work, devices fall apart, my computer needs to be removed from my back with a hoodie as an oven mitt because I never know when it will wake from sleep on its own.",0
The onboard software packed with this is very nice and limited,0
"The display is absolutely magnificent and MSI's ""True Color"" options really make a huge difference.",0
The graphics card is solid and can power 4 displays,0
The picture is bright and clear and really pops,0
The 128gb ssd feels rather useles(on bigger titles) and would preferred paying 100 usd more for a 500gb ssd instead.,0
I'm currently using it for video editing and gaming video capture for my Youtube channel and so far so good.,0
The battery life seems to be pretty good for everyday tasks and the fans are quiet,0
"Prime 2-day delivery, triple boxed for protection, nicely packaged from MSI",0
It's upright firing speakers have superior sound quality to its competitors as well.,0
the light bleed at the top corners of the screen is a little too much,0
The keyboard and touchpad are adequate,0
I love the design and materials and handling,0
Screen brightness is extremely dim,0
Runs games like fortnite and GTA on highest settings and quality.,0
it is super lightweight,0
The speakers are week and sound quality is just crap.,0
there is a risk to receive one with damaged motherboard,0
"I'm very happy that they included an ethernet port, as it allows me to avoid using VPN authentication at work",0
It has a powerful four-core Intel processor,0
It works really well and is very fast.,0
I was surprised how light it was.,0
First look the laptop is solid,0
Only nuisance is that the right shift key is placed outside of the arrow keys.,0
"Battery life is poor, as to be expected from a laptop of this nature",0
"The battery life is really nice for a gaming laptop as well, and the keyboard is fantastic, even without the numpad",0
"Video that is nice and responsive, with decent resolution.",0
"no matter how I tried, I could not get it to power up",0
"there was a noticeable .5 second-ish lag every time it switched, which was often.",0
"Thermals are great, I can play heavy games for hours and it never throttles",0
the anodized brushed aluminum case is a bit of a fingerprint magnet.,0
the SSD is reletively small in capacity,0
I do wish that there was a windows hello enabled camera or a fingerprint reader.,0
got a sleek and thin laptop for an amazing performance,0
Extremely light and durable.,0
the sound is great and it has some audio stabilization ability so when you blast a song it lowers the levels so it doesn't pop your speakers,0
Keyboard is responsive.,0
This has been a truly awful customer service experience and I’ll be going elsewhere for my gaming devices from now on.,0
"The laptop is really thin, and the screen looks wonderful, with crisp bright detailed images.",0
"it is slim and not bulky, making it very portable.",0
WIndows loads up and restats FAST because of the SSD.,0
The keys feel wonderful. The hotkeys on the keyboard are super helpful and function well.,0
It was so easy to transition from consoles and im happy to leave the glitches behind.,0
The screen is really bright and you can see more definition than either Ace,0
The keyboard lights up with different colors which is something he really likes with his computers.,0
"This thing is quite the monster, its fast with the 1660ti.",0
the lag while in use is entirely unacceptable,0
I Want to say that my favorite part about this laptop is how it manages to stay quiet for everyday uses like web browsing or watching films or streams,0
The keyboard and mouse pad have been moved closer to the user of the laptop allowing your fingers to not feel like you are typing on fire.,0
"Computers should possess quantum computing capabilities, enabling them to solve complex problems exponentially faster, revolutionizing fields such as cryptography, optimization, and scientific simulations",1
The screen is simply amazing. I watch sports videos on it and they are super crisp.,0
This laptop was easy to setup,0
Completely disappointed in both the product and the customer service available from Amazon and Samsung.,0
the touchscreen makes it much easier to navigate,0
Screen bleeding left upper corner (only on black screen of course) and black dot (like dead pixel) in lower left part of the screen.,0
The color scheme is awesome,0
The batter life works pretty well,0
the sound quality is very bad and does not go very loud,0
I wish on the PSU there would have been a USB port.,0
it's annoying that i couldn't find it through the windows app store.,0
"the battery port is on left side of the computer, which keeps being slightly inconvenient",0
The computer gets ridiculously hot and the fans will spin up like a jet engine even when just the browser is running.,0
limitation in steelseries keyboard to bind FN+anykey *currently only able to bind FN+numbers 0-9,0
Product arrived damaged directly out of the box.,0
The back lit keyboard is very convenient - and it is beautiful!,0
I noticed that the fan kicked into high gear and it got very hot.,0
Battery life is good to with average 9 hours.,0
The audio from the speakers would fade away,0
"It looks great, feels great, performance is fine",0
it is very portable being less than 5lbs.,0
the laptop has amazing build quality graphics are good 110+FPS in 1080P,0
The color and contrast quality of the screen is lacking,0
wifi is quick,0
"Instead of admitting they are knowingly selling bad harddrives, they argue about they can't help hard drive failure.",0
wifi was strong and fast as well,0
It could've been really nice if it had double slots for the storage.,0
the setup was so easy and was spelled out every step of the way,0
you will find the most infuriating thing is the STUPIDLY PLACED UP BUTTON.,0
The black and gold really make it look for sexy.,0
I love how lightweight it is and it all-around is a very sleek looking laptop.,0
Computer response is fast and snappy,0
One of the fans has decided to start screeching due to being misaligned from wear and the laptop is unusable.,0
Keyboard keys have decent travel and is easy to type on.,0
Audio is adequate and monitor resolution not that sharp,0
Screen resolution is great for gaming with no lag.,0
"The constant crashes when it switched video cards, and my favorite constant blue screens of death from the NVIDIA driver no matter what I did, reformatting, clean install nothing.",0
So I received my AeroBook yesterday from a crowd funding campaign.,0
it will suck you dry if you are on performance mode.,0
Wireless performance was very lag spikey with the included wireless module.,0
anything intensive will see much worse battery life,0
the sound is pretty solid,0
Screen is great as well as the keyboard and under full load it is actually quieter than my old laptop which was 3 times thicker and way bigger .,0
"Touch screen is great, speed of turning on and off the laptop is super fast",0
the fans do get loud on turbo mode,0
"The new Intel chipset and 1060 combined deliver incredibly smooth graphics and ultimately have no stutter, delay, or any other noticeable hiccups while multi-tasking for work",0
The screen color is amazing and perfect brightness,0
The resolution is almost overkill for a screen this size,0
Set-up is a breeze,0
This is a great choice - you have a lot of headroom in this CPU to take on whatever you are going to throw at it,0
A built-in AI assistant to complete routine tasks quickly and accurately,1
It's a good deal for a thin and beautiful looking gaming laptop,0
"The sound, with the Bang & Olufsen speakers, is excellent for a laptop",0
I had a problem with the shipping as they sent the wrong product,0
Speakers located under the laptop facing down which muffles sound,0
"I love the performance, keyboard, and track pad",0
"The new generation of Intel Processor is noticeable, smooth and fast!",0
"Aside of better graphics and newer Intel, it's pretty lightweight compare to the Nitro 5.",0
"The keyboard uses the steelseries technology which allows you to customize the keybinds, colors, and animate the keyboard! This is very unique and well designed!",0
Wish it had one more thunderbolt port instead of that mini display port,0
I had difficulty getting the HDMI port to work at 4k @ 60 Hz and instead rely on the mini-DisplayPort adapter for this instead.,0
"I love the laptop, including the sleek look of it.",0
The keyboard feels very good to use and the back-lighting is a nice touch,0
it always blue screen when playing game and I try to fix it (e.g. update the driver or windows) by finding the solution on internet but the situation still happen.,0
I have with this laptop and the Razer brand in general is coil whine.,0
