sentence1,label
The upgraded 1080p screen is well worth buying this version for if you watch videos.,0
this laptops keyboard is actually useable for gaming,0
A biometric security system that can identify users before allowing access to sensitive data,1
The keyboard is fantastic,0
"2 months in and it suddenly went completely blank. No predator startup logo, no getting to bios, no booting from external media, no way in.",0
Windows will fail to update on this machine if any USB or USB composite devices are attached when trying to upgrade.,0
It has nice speed and is very lightweight compared to my old HP laptop,0
A chatbot that engages customers in discussion about what they are looking for,1
"I needed a small durable laptop that can handle lots of artboards, heavy psds, animation, video editing etc",0
It is slim and lightweight.,0
setting up keyboard RGB was confusing.,0
the keyboard is a little flimsy,0
arrived with a dent in one speaker and bad backlight bleed in one spot at the bottom of the screen.,0
CPU overheating to 103°C while gaming (AMD states Max is 105°C),0
A computer with a built-in mini projector,1
the computer has an AI Widget that continuously opens up and runs despite me closing it down,0
Watching movies on the full HD screen is as crisp and clear as any glass LCD screen.,0
I like the old way that to scroll down you slide your finger down not the opposite,0
"My fan started literally chirping like a bird 5 days after I bought it, and is now screeching weeks later.",0
8 GB RAM and the latest 8th generation core i7 processor makes it superfast,0
Some units have more backlight bleed,0
Speakers are not loud enough,0
Great thin design will swivel door USB-A allows an ultra-thin profile but still has 2 USB-A ports.,0
The keyboard is great and I love the 1 zone RGB.,0
The fingerprint sensor is reliable and makes signing in quick and easy.,0
It does get pretty doggone hot on the bottom so it isn't great for use on the lap,0
"The led light under the key is working, but the key itself is not responding.",0
The keyboard works well for my needs,0
Very thin and easy to carry around,0
the keyboard doesn't lock on one side of the tablet,0
The video card does not seem to work with the built in monitor,0
The keyboard rgb lighting is great for use in a dark room.,0
"The plug has bright blue light that never goes off. It is nice to be able to find the plug, but it never shuts off and it is so bright, not something I would want to keep in my bedroom. It is a mild annoyance.",0
It looks nice and handles real good,0
The weight is pretty light and the size is great.,0
The 144 Hz display is smooth and steps-up the game performance for sure.,0
I experience touchpad delay occasionally,0
the membrane keyboard feels decent and is VERY quiet.,0
the construction feels a bit flimsier than I'm used to,0
I purchased this coming from a daily Surface Pro 3 user because I wanted something a bit more powerful for work and play.,0
Sound quality is much higher than you'd expect for laptop speakers.,0
The track pad isn't great. Sometimes it's weirdly sensitive and mistakes a scroll for a click. Other times scrolling is difficult,0
Keyboard can be fully customized in the steeleseries app that comes installed on the laptop and feels nice to press,0
This thing is worth the money.,0
this laptop feels very well built.,0
Bought it because I need a tablet for travel purposes,0
I am able to run multiple plugins live with no audible latency!,0
"This is a toy, and not even a good one at that",0
resting palms on it will definitely leave prints,0
Only negative is that speakers are on the bottom.,0
Good set of I/O ports for the slimness of the laptop,0
"some of the keys are printed in a nonstandard way. They are flipped with the question mark under the slash, etc.",0
it could have problems with motherboard or ssd,0
It feels great and looks great.,0
"It has been able to handle multiple games easily, including the Anthem demo this weekend.",0
The display is amazing for somebody that has been accustomed to 60hz,0
Connecting to the network and internet was easy / breezy,0
The hinges have just enough flexibility to easily convert from laptop to tablet mode.,0
Keyboard is surprisingly comfortable to type with,0
"a good graphics card, tons of RAM, decent SSD and it's lightweight.",0
my new Zenbook is a very attractive light blue aluminum and has blue metallic keys instead of black plastic.,0
"Thin, good battery life, games well and looks stunning",0
"I don't know if the noise, the sometimes performance lag, or the quality of the material it is built with.",0
"A portable device with an integrated printer, so you can print out important documents and photos on the go",1
"Downloads are faster, as are software installs.",0
The best of both worlds between a desire for a tablet and a desire for a laptop comes with the purchase of a 2-in-1 laptop.,0
I'm constantly getting disconnected from wifi and when I am connected it's very slow.,0
I think I would have been happier with the bigger screen.,0
"I found the build quality great, and the keyboard is super nice to type.",0
"a keyboard that has customizable backlighting and macros, allowing you to tailor your typing experience to your preferences and needs, meeting the 2018 standard for keyboards.",1
The touchpad is accurate and offers plenty of gestures,0
The larger touch pad is a nice addition and allows easier movement across the screen without having to lift your finger and start again,0
"You can easily change clocking speeds, fan speeds and configure this laptop for high-end functionality.",0
"Lightning fast, with 32GB RAM for the most demanding apps",0
"Plant-based, biodegradable plastic that is strong enough to withstand heavy gaming yet gentle enough to protect the environment",1
The upper side of the keyboard is getting very hot.,0
these edges dig into your legs (if you are using it as a LAPtop) and it quickly becomes uncomfortable.,0
I have gotten was the screen bleeding once screen is dark.,0
The design is sleek and streamline,0
Stays acceptably cool with minimal throttling.,0
It's built solidly and performs well.,0
a bunch of dead pixels in the center of the screen about four inches from the left,0
Beautiful screen and only 2.2 pounds as advertised,0
If AORUS offers two AC adapters to end user will be fantastic!!,1
this is very sufficient for 1080p gaming at high to very high settings.,0
the speaker suddenly cracked and made a horrible loud snap and static noise,0
I don't think anything like video or photo editing or machine learning should be attempted on this.,0
The colors were really beautiful.,0
I had a very positive experience with technical support even though they weren't able to solve the problem remotely.,0
"The hardware is top notch, build quality is excellent and performance is just screaming fast.",0
"Bright screen, extremely solid performance.",0
"As for the camera, the quality was bad",0
its the current generation 6 core and runs smoothly and flawlessly,0
There is a super easy to use power saving mode that extends the battery life,0
"Along with the fully customizable keyboard, there is also the great screen scan is super fast and has great pixels.",0
It's fast enough to do everything I need and won't weigh you down.,0
I have purchased multiple laptops and this has to be my favorite one so far.,0
"the viewing angles are great, and the body itself is simply beautiful",0
"It is sleek, light and looks great.",0
good luck getting support from MSI their customer service is almost impossible to get a hold of,0
Ranging from smooth typing keyboard and the unique design of keyboard layout make the functionality stand out compared to other laptops that I have used.,0
I needed a replacement and customer service was just as terrible trying to scam me taking about $600.,0
The fans are always up in speed,0
the surface of the laptop becomes really hot when you play demanding games,0
The bezel is thin just right for me,0
"the computer is very amazing, the colors are bright and it is well built.",0
the fan is a little loud at times.,0
"it arrives in a sleek, black box with a beautiful photo of the laptop on its cover",0
The laptop looks great and thin just like I wanted.,0
my new laptop arrived with a noticeable bend in the scree,0
"Thermals are great, GPU never exceeded 71c at 100% usage, no throttling that i was aware of.",0
Powerful gaming system in a slim form factor.,0
"This is a well constructed machine, looks pretty, works fast enough for the use most people needs",0
The touch screen is great but some sites require a cursor.,0
"The design is slim, slick, and professional, the lattermost of which was another significant selling point for me",0
it is very fast,0
The fingerprint sensor took a while to calibrate,0
"Crystal clear, and plenty of resolution for a screen this size.",0
It is worth for the quality and durability.,0
"The design is superb, very stylish and eye-grabbing, without being tacky",0
A touch screen would be nice,0
the display looks incredible,0
It does tend to get hot in the lap and the fan can be loud even at a moderate speed.,0
When playing games (and sometimes just randomly) the fans whir up really loud for the extent of the game,0
The font on the keys is a bit odd,0
The device arrived faster than quoted packaged excellently,0
I was looking for a lightweight laptop that is good for gaming.,0
i have been able to download and use the apps i want,0
the battery life has been excellent with 6-8 hours of life,0
Provides portable gaming power at the same levels as a decent gaming desktop machine.,0
"It's not very durable, very lagy",0
"I'm a software developer, so I need a fast machine to do my daily work, and gamers notebooks usually fits this requirement.",0
It's a bit noisy,0
Build quality of chassis is top tier.,0
"in the middle of the display, a big rectangular patch of grayish color.",0
The graphics card speaks for itself in many ways and lives up to the expectation,0
"Its very light (4.65ish pounds), looks very sleek and thin",0
The hinge lift is an excellent feature.,0
it is filled with wonderful features,0
I am pretty sure that this thing is actually a fingerprint magnet.,0
"Out of the box set-up was simple, clean, and easy.",0
I am excited to use this for video production as well and imaging stuff very soon!,0
The look is sleek and impressive.,0
IT IS MORE THAN CAPABLE OF MOST OF YOUR DAILY ACTVITIES WITH OUT THE USUAL BLOAT IN TODAY'S LOWER PRICED OFFERINGS.,0
the overall tone is too blue in my opinion and I was unable to correct for it to my taste.,0
Battery life is also good enough,0
Vega support is not there or is hard to setup,0
"The screen is beautiful at 144HZ and it seems larger than it is, thanks to the thin bezel.",0
"A laptop with an onboard document reader, scanner, and photo editor",1
This keyboard is amazing.,0
CPU power is little poor.,0
It also has bad backlight bleeding.,0
"Typing feels great with crisp key action and back lighting, especially compared to some 2-in-1s' floppy detachable keyboards.",0
"The backlit keyboard is well-designed, with the keys having a surprising amount of travel for so thin a laptop.",0
"Gorgeous, functional and very powerful laptop",0
A feature that allows for different users to customize the device to their individual preferences,1
The keyboard layout is weird and unusual,0
Some other features i enjoy and was surprised by are the sound system and the charging system,0
It is surprisingly small and light which are great qualities while still maintaining the feeling of a durable and structured laptop,0
"The GPU is very powerful for this size, it eat everything I through at it.",0
"This computer shipped really fast, it came a day late but amazon took care of that.",0
"MSI managed to squeeze a powerful desktop into a 5lb, slim laptop form factor",0
the texture of the laptop feels quite nice and it definitely turns people's heads when they realize that this portable laptop can out perform most home built desktops for about the same price.,0
When you plug in the charger there is a static sound coming from the laptop,0
The only problem is that the delete key is right next to the on/off key.,0
it come with defective screen and a dead pixel and light bleed,0
it was a soft click when the fans were ramping down in speed but it eventually turned into an annoying hum when gaming.,0
"There is no back light on the keyboard, which is misleading and so frustrating.",0
"It’s perfect for video conferencing with the two microphones, audio is sent flawlessly.",0
It still feels solid.,0
The sound quality was better than expected and the sheer portability is king for a truck driver,0
"the keys seem completely flat, so I found it hard to center my fingers, and often hit two adjacent key simultaneously",0
"The programmable keyboard allows for both a creative design for your home, and a simple business oriented design for work.",0
"The keys feel like the chiclet apple-style keys, they're great.",0
The customization and colors of the keyboard are a wonderful bonus.,0
"The computer is fast, clean and good looking",0
Steel Series keyboard lighting control is a bit glitching when swapping between games & desktop mode,0
"I can hear the fan, as well, which some people may find annoying.",0
Zenbook 14 has a very good sound system.,0
Very loud fan noise when it becomes heated.,0
The aesthetics of the laptop also make it very appealing.,0
"a built-in digital-to-analog converter that converts digital audio signals into analog signals, providing higher-quality audio output.",1
it was not consistently fast,0
battery life isn't as good as reviews claim,0
The laptop also gets incredibly hot and loud when gaming at high settings,0
The 4K screen is beautiful and very responsive.,0
That's plenty fast for the typical user,0
The back panel u unscrews and comes off for easy access unlike many other laptops.,0
"Looks great, works great, is lightweight and portable, and gets the job done.",0
The top of the track pad has a gap,0
RGB is cool and very easy to customize with the included Acer app.,0
"The battery last a long time, it was several hours watching Saturday westerns before he asked for a charge.",0
the fit and finish of the laptop seems pretty nice.,0
The labels on the keyboard wont come off and will ruin the whole laptop usage as your hands will stick and it wont come off.,0
They responds with their generic emails and never answer my question or help me.,0
Armoury Crate software took a few minutes to get acclimated with to adjust the lighting effects and color for the RGB keyboard.,0
"a case that has plenty of available drive bays, allowing you to add more hard drives or solid-state drives in the future.",1
"The screen bezel is super-thin, yet they managed to fit a camera on the tip edge.",0
AMDs APU combined with the 2-1 format provides a great mixture of speed and versatility.,0
it is very slim and light and extremely portable,0
loads pretty quick and runs the programs I need pretty smoothly.,0
a small light leak on the corner of the screen,0
"This is worth every penny a gaming laptop under $1,000.",0
This laptop is fast and very responsive though it takes awhile getting it there so make sure you go through the Windows 10 settings with an fine toothed comb.,0
it’s a fast and well built gaming laptop.,0
the graphics seems to not be compatible with any version of Photoshop,0
Color Quality is great and can change the tones of the screen with the MSI Center.,0
The connection was always lose and prone to falling out or being bumped and damaged.,0
"this was probably a motherboard melting down, or some other small and unusual mechanical failure.",0
I can't figure out is how to change the keyboard from breathing lights to a solid color lol,0
the laptop connected to a power source in order to run at a good frame rate for most games!,0
I have a single pixel that is a bright green all the time,0
It arrived with a split in the wire loom that exposes the wires running through the cord.,0
"I was impressed with the shipping packaging, as it allowed the laptop to arrive undamaged even after getting the box deeply gouged and dented.",0
Keyboard is soft and nice,0
"the quality is top notch and everything feels very ""Rich"" and like it was made with thought.",0
The laptop is extremely flimsy I was so afraid to bump it on anything so I bought a padded laptop sleeve and a padded backpack for it.,0
"Great build quality, battery life, cooling and performance for the price",0
A computer that utilizes AI-driven natural language processing to automatically respond to user requests,1
"The touchpad loses contact with finger very easily, so you're vigorously trying to get the pointer from A to B.",0
"The keyboard does feel sturdy though and the back lighting is really customizable as are the graphics, fans, and different profiles (battery/performance/etc.)",0
The laptop overall is relatively thin and feels lightweight.,0
Screen scratches easy if you are not careful,0
the fans get very loud when playing games.,0
"This is a well constructed machine, looks pretty, works fast enough for the use most people needs.",0
"light weight and has most of the connections u need, screen colors are good",0
Occasionally have issues getting the WiFi to connect.,0
the battery life is pathetic,0
"after a session of intense gaming, the Alienware logo button (on/off) can become exceedingly hot.",0
Battery life is an issue if you plan on playing it unplugged,0
I've run some simpler programs that were met with loud-ish cooling efforts,0
"there are some instabilities apparently Ryzen related which end on system-wide freezes, should be patched within some months.",0
The setup was actually pretty easy.,0
it's insanely light and very portable,0
"I received an RMA number, but was told it itll be 3-5 business days before they unbox it, and another 10-30 business days for in-house turn around time.",0
there are the usual ports you would expect to find.,0
"The way the replacement unit behaved, makes it a likely and very uncomfortable possibility.",0
The sound is on the weak side,0
The battery goes pretty quickly,0
the battery life isn’t that great,0
"This thin laptop complete with gold accents is perfect for carrying around, as I will be starting college soon.",0
I am very disappointed in the limitations that the Acer 3 has on connectivity.,0
I've tried to talk with Razer rep but they just seem to be buying time for my 30day replacement period to end,0
"It is very responsive, transforms from laptop to tablet quickly and easily, has a nice build quality, looks and feels good (including the keyboard).",0
"The screen quality - 144hz 1080p IPS is very bright, crisp and clear.",0
The pen feature is very responsive While she was writing and drawing.,0
Received a good QC product from Amazon.,0
Very convienient to have a physical Turbo Boost button,0
The resolution is awesome.,0
I like that there is a physical switch to turn off the internal camera.,0
"The boot-up is very quick, so you won't have to worry about it loading for a long-time when class starts.",0
I received the package last night in San Diego and after charge it for over 3hours and try to turn it on the screen was blank meanwhile the keyboard light was on,0
The packaging was very thorough and included a rather large microfiber cloth and ensured the laptop made it without any issues.,0
"the screen can't be laid back much, it only opens to certain degree which is not enough for my use",0
I kept essentially crashing the graphics due to the ptt key being control,0
I love the fact they removed the Windows key from the WASD side of the keyboard,0
The aesthetics are the best you're going to find on any high-end laptop.,0
It’s a lightweight (3.1 lbs.) for a 14-inch unit,0
"BCI technology aims to establish a direct connection between the human brain and computers, enabling seamless control and interaction without physical input devices. By integrating neurosensors and sophisticated algorithms, computers could interpret brain signals, allowing users to navigate interfaces, control applications, and communicate purely through their thoughts.",1
the design is beautiful (for a gaming computer of course). Its portable (for a gaming computer of course),0
Red backlit keys are a cool feature.,0
Has very low sensitivity so when you are trying to move the cursor over something small to click on,0
Updates and getting everything up to speed was lightening fast.,0
"The machine was great; it was quiet, it performed well, and it was light weight.",0
"This laptop has fantastic build, it feels more premium than what it costs",0
Everything is solid. I love the screen and LOVE the keyboard.,0
I don't love that it's centered on the machine,0
"It's lightweight, fast & the graphics are good quality.",0
the overall build quality was low.,0
I have had constant issues where this laptop crashes because it runs into problems.,0
the CPU drops dramatically when unplugged,0
The audio is the best I've encountered,0
pads for the screen and chassis when closing the laptop,0
I'm absolutely loving the touchpad and feel of the keys as I work,0
Screen looks great and works well,0
lack SD card reader and ports,0
"The battery is good for a performance laptop, the quality is great so far, and it's extremely convenient that it's so light.",0
They have the ABSOLUTE worst customer service.,0
"It's really thin, and without the compromise of no LAN or no camera.",0
It has the best processor you can practically get in a laptop right now and has plenty of ram to go with it!,0
it's been amazing and easy to use so far,0
I called tech support for ASUS and they could not help.,0
Thin and sleek without compromising on performance.,0
The price is definitely the selling point of this laptop along with the lightweight portability.,0
"a flexible or foldable display, allowing you to use your computer in different configurations or positions.",1
It is a super-dust magnet.,0
"It charges fast, the battery lasts more than 7 hours deppending on the use",0
"The Dragon Center is incredible, I'm able to monitor everything about my laptop",0
Great value buy for a student/professional that works alot and likes to game as well.,0
Very pleased with the performance of this laptop for the price.,0
battery life is really long to 11 hrs,0
the laptop creaks when I pick it up,0
My laptop came in with a broken mouse pad.,0
The exterior is nice and sleek,0
"Drawing inspiration from biological systems, computers with bio-inspired computing capabilities could emulate the efficiency and adaptability of natural processes. By incorporating principles such as neural networks, genetic algorithms, and swarm intelligence, these computers could solve complex optimization problems, simulate biological systems, and revolutionize fields like healthcare, logistics, and robotics.",1
Resolution looks good whether reading or launching a movie,0
The Dragon Center is a tool worth loving and I can't be more happier with my purchase,0
the space bar is sunken in on the right side and works only half the time when pressed with the left thumb while touch typing.,0
The windows recovery and setup screens are in RUSSIAN only!,0
the speakers are on the bottom of the keyboard but they get very loud.,0
"It has a great screen, comfortable keyboard, it is light, and best of all, it runs games really well.",0
It has beautiful color and contrast and really impressed me as soon as I turned the computer on.,0
"the case does creek a little bit, and the battery life is nothing to praise",0
Gs65 can handle most of them and provide smooth gaming experience.,0
Touchpad quit working within few days of getting the computer.,0
The model I purchased came with the GTX 1060 and can play most games on high,0
I asked them to replace it and they were going to take it away for 2 months while I was in school.,0
The trackpad has good sensitivity and response as well.,0
Charging is amazingly fast. It took less than an hour to get to 100% from when it arrived.,0
high frequency noise coming from the notebook when the CPU is under some load.,0
Computer gets very hot which causes loud fans,0
"The laptop feels very sturdy, but it is very lightweight.",0
Have been playing a lot of R6 on high graphics hitting 144fps easily with no screen tearing.,0
"The computer boots up instantly and has very little post-startup lag, making the fingerprint reader very nice to have as login time would be the time bottleneck in getting started otherwise.",0
Everything runs so well and the design is so sleek,0
"The mouse pad is absolute garbage, some parts it goes very deep into the frame if you press with a small degree of force, other areas of the pad resist the pressure.",0
"The keyboard is awesome and colorful, with yellow, orange, purple and blue keys.",0
eyboard feels good and the lights are fairly easy to configure,0
It is fast and the MSI dragon center is very easy and good for monitoring the cpu and gpu.,0
Finger-Print sign-in works great.,0
Runs a bit hot on the surface when gaming and the fans a bit load,0
The touchscreen is bright and beautiful with a full HD (1920 x 1080) LED backlit widescreen.,0
I like how light and well built the laptop is,0
The 144HZ frame rate is butter smooth and totally worth sacrificing a 4K display for.,0
I do hear very slightly coil whine from my 1070 laptop,0
I would have liked the external speakers to be louder,0
"It feels loose and hollow, therefore it is very noisy, even with the slightest touch",0
It has very crisp graphics,0
it's a really powerful gaming laptop with nice gaming LCD screen with very high refresh rate,0
Quite a bit of bloatware included,0
"But expect fatigue if you are trying to type reports, essays, articles, or a novel.",0
The sheer lightness of it makes me somewhat leery about potential damage,0
"Augmented Reality (AR) integration for immersive gaming, 3D modelling and other creative tasks",1
