text,label,novel
i play counter - terrorism : global offensive b then a laptop with security monitor refresh on screen was very important from me.,1,0
"i needed a small machine that was reliable, made better battery life and seemed just as powerful for current gaming needs",1,0
i play a number of games so i want the computer to run games well.,1,0
actually'm a serious gamer and the hardware gotta work top notch,1,0
"i go to work via public transportation so it's important for me to have a compact, thin and light laptop.",1,0
the computer i want should look cool and own a nice graphic card.,1,0
"i needed anything small for workshops and travelling, but robust enough to do slight gaming, preferably heavy games.",1,0
it would ' ve labeled genuinely impressive if the keypad that a little bit more travelling telecommunications.,1,0
"as a college student, i am finding an affordable laptop which has a solid construction.",1,0
i do wish it had a little more internal storage,1,0
the computer should be light for me to carry it around.,1,0
i would approved removed fine with a long space bar.,1,0
i would use the computer for light gaming so i hope the computer would play games well.,1,0
i have got a number of needs on my new computer so i am hoping for a cheap computer that fits all my needs.,1,0
"i need something to bring to work and i hope it would be thin, light and sturdy.",1,0
i want a computer with great colour and viewing angles.,1,0
i am not a computer savvy and i want a computer that is easy to use.,1,0
i am buying a laptop for my brother who just entered into college and the amount of storage ought to be more than enough.,1,0
"i location a small lasting laptop that can administering lot of artboards, heavy psds, animation, videotape revisiting etc",1,0
i have been doing a lot of research on computers and i have been longing for a computer that is light and fast.,1,0
i need a few criteria for my new computer.,1,0
the computer i want should handle all my needs with a good price.,1,0
i don’t want my computer to slow down so a no is for those bloatware.,1,0
i am buying a new gaming laptop for my husband and i want a red backlit keyboard so it would be warm and comfortable to his eyes.,1,0
speed is what i look into when purchasing a new computer.,1,0
i need a cheap computer with solid build quality and awesome cooling system.,1,0
i want a computer with long battery life.,1,0
i am finding myself a new computer that has a sharp screen and a good bluetooth connection.,1,0
i would be willing to pay an affordable price for a computer with amazing sound.,1,0
atomic number 53 wish on the psu in that location would have been a usb port.,1,0
"i spent a long while look for that holy trinity of game laptops: thin, powerful, and good battery living.",1,0
i wish it was a full keyboard with the number pad to the right,1,0
i want to spend as less as possible on my new laptop.,1,0
i am buying a computer as christmas present for my son and he specifies that it has to be great for games.,1,0
"if you have an ethernet usb dagger and a usb type c charger, it will be great",1,0
i am finding a new computer that has a high performance-cost ratio.,1,0
i do likes that there beat a window hello guaranteed camera or a fingerprint reader.,1,0
i don't have much requirement on my new computer but i want it to be easy to setup.,1,0
"i am in need of a new computer with good build quality, screen and keyboard.",1,0
a fast computer with a great price would be what i want.,1,0
i am finding a new computer with nice price and good speed.,1,0
i recently need a new computer that comes with high speed and minimal bloatware.,1,0
i want a fast computer.,1,0
i don't want to annoy others so i need a quiet computer.,1,0
it is time to replace my old computer to a quicker one with a better performance-cost ratio.,1,0
"i demanded a small scale sustainable laptop that can administering lots of artboards, heavy psds, animation, videotape editing etcetera",1,0
1 wish it was a full keyboard with the number pad to the right,1,0
i want to purchase a computer that is portable and lightweight.,1,0
i am finding some recommendations for a new computer that is fast and have both nice cooling system and battery life.,1,0
i need a computer within my budget.,1,0
i want a computer that run games without issues.,1,0
my wife wants to play more demanding games so she needs a computer that handles games well and quick.,1,0
i am into coding and i need a new computer with plenty of ram and amazing build quality.,1,0
i read a lot of reviews and i decided i would buy a computer that is fast with a budget price.,1,0
i have just retired and i am finding a computer for my personal use.,1,0
i am a performance ethusiatist and so an awesome processor is a must.,1,0
i need a strong upgrade from my old computer that is faster and has better screen.,1,0
"i needed a small scale sustainable laptop that can handle lot of artboards, heavy psds, animation, videotape updating etcetera",1,0
i want to have a new computer that has a high hard disk capacity with an excellent price.,1,0
i want a laptop that could handle the smaller data processing jobs before transferring to a larger tops figurer.,1,0
i do likes it approved a little more internal warehouses,1,0
"out of all the features, colour is the aspect that i pay most attention on.",1,0
me do wish it looked a bit more internal storage,1,0
i think i will be more happy and bigger.,1,0
my old computer isn't working and i need to find a new one that is sleek and light.,1,0
i bring my laptop everywhere i go so i would like it to be sleek and lightweight.,1,0
i am in college and i need a sturdy and solid computer that comes with a high response rate.,1,0
i am willing to do some research for a good computer and currently i am finding one that play games with good frame rate.,1,0
photo editing is my job so i would need a computer that have good screen resolution.,1,0
the touch screen will be fine,1,0
i am planning to replace my old computer and the new one should come with high performance-cost ratio.,1,0
i do the computer for school work and i want it to come with slicky trackpad and good keyboard layout.,1,0
my regular computer needs repairment so i am finding a new one with nice display in a low cost.,1,0
i can get a cheap computer and upgrade it later on.,1,0
care it had one more than thunderbolt port instead of that miniskirt display port,1,0
i call up i would take follow happier with the bigger screen.,1,0
i want a computer that have great specs and amazing cooling.,1,0
the computer i want should handle my games with ease and run super fast.,1,0
i was looking for something light but black and thin. our ultrabook achieved those goals.,1,0
my old computer is too heavy and doesn't last long so i need a new one.,1,0
a fast computer with a good price is what i want.,1,0
i am buying a new computer for myself on black friday and i want it to play games well.,1,0
our homeschooled kids need some computers with large screen for learning.,1,0
the computer should have a light but large enough screen accomplished with speed.,1,0
"for my meetings, i need a light computer with a long battery life.",1,0
i need a computer which is fast and light.,1,0
i edit photos for a living and that's why the graphics must be great on my computer.,1,0
it do have been also nice time have more the flexibility than stand in either the left or right side from charging.,1,0
i like taking my laptop around so i like it to be light and good looking.,1,0
i wish on the psu there would have been a usb port.,1,0
i am finding myself a new computer that is light and come with nice size.,1,0
it would ' ve been bang up if information technology came with the ethernet usb dongle and the usb type c courser,1,0
i need a light and fast computer.,1,0
i have got a list of requirements for my desire computer.,1,0
my old computer doesn't work for me anymore and i am finding a new one with terrifc specs in a great price.,1,0
"i am in need of a new computer that is fast, sleek and economical.",1,0
i need a fast computer.,1,0
i am finding a replacement for my old computer that a longer battery life is expected.,1,0
i am finding the best computer that worth my money.,1,0
"i ' m a software developer, so 1 need a fast auto to do my day to day work, and gamers notebooks normally fits this requirement.",1,0
i do a couple of tasks on my laptop si i want it to run games well with a reasonable price.,1,0
i like having computers having high performance-cost ratio.,1,0
i am buying my first laptop and i have thought of some requirement for it.,1,0
iodin play counter - strike: world wide offensive and having a laptop computer with a high refresh charge per unit screen was real authoritative for me.,1,0
what i expect is a good computer with a high performance-cost ratio.,1,0
a touch screen would supported nice,1,0
i hope the new computer meet up my expectations with the money i paid.,1,0
i need a light computer that is perfect for my business.,1,0
i am looking for a replacement of my old computer which i require it to have a high performance-cost ratio.,1,0
i want a computer with high speed and a tiny power adapter.,1,0
i need a computer with a high-performance-cost ratio.,1,0
i need a new computer for myself that is lightweight and fast.,1,0
i am in need of a new computer that is responsive and snappy.,1,0
i hoping it doc come with at largest a 500gb ssd since the space on this will supported satisfied up shortly,1,0
they wanted any laptop that could keep the smaller memory card jobs before transferring to a larger super os.,1,0
i want to change my old laptop and something cool that handle most games would be perfect.,1,0
i am finding a new laptop for gaming and a short boot up time is expected.,1,0
i want to gift a nicely priced computer to my brother-in-law.,1,0
i need a real fast computer.,1,0
i hope that the fingerprint scanner is a more sensitive tad bit.,1,0
my old computer is sick and so i need new one that stays cool and quiet.,1,0
i wish information technology did make out with at least a 500gb ssd since the space on this will be filled up soon,1,0
i pictured the powerhouse that was powerful and fast.,1,0
mom was searching for a laptop she would meet my needs for gaming and have that security charge we take on the loan to do school...,1,0
i treasure every hour of work so i need a fast computer.,1,0
"thomas spent a long while insights into that holy queen of gaming women : thin, neat, and good of life.",1,0
i do a lot of professional tasks so i need a computer that run tons of programmes well with a fair price.,1,0
"i am buying a new laptop for my husband and he wants it to be lightweight, clear and sharp.",1,0
"i need to change to a new computer and i want it to have high portability, good display and good battery life.",1,0
"i wanted something to replace my college laptop (a big, heavy 16"" dell with an i5 processor) that could handle overwatch at its high settings while still maintaining its ability to be a professional looking laptop.",1,0
i am a teacher and i need the computer to look top notch.,1,0
my old computer was on fritz so i need a new computer that is quick and easy to setup.,1,0
"i spent a lengthy shot wishing for that odd trinity of gaming experiences : thin, powerful, really good battery pack.",1,0
my old computer needs replacement and i am finding a thin one with awesome design.,1,0
"i did a lot of researching and i need a new computer that is fast, cheap, light and slim.",1,0
i am purchasing a new computer mainly for gaming so it should play games smoothly and have a gorgeous screen.,1,0
i am not satisfied with my old computer and i want a new one that is light and portable.,1,0
i am new to gaming laptop and i want one that run flawlessly for games.,1,0
i wants it ben a full keypad with the numbers pad to the right,1,0
if aorus offers two ac adapters to terminate drug user volition personify fantastic!!,1,0
i am getting into gaming laptop so i want one that runs most games smoothly with good specs.,1,0
a fast computer with a reasonable price is what i need.,1,0
my computer just recently broke down so i need a new computer immediately.,1,0
"i work all time on computer so i am finding a new laptop that is fast, sleek and flat.",1,0
i don't mind spending more money for a good computer.,1,0
"ane require a herculean, yet inconspicuous political machine that i could take to a encounter and open up on the conference table and not look like i thought one was showing upwards to a lan party or esports orbit.",1,0
"i needed any rather durable edition that would do lots in artboards, heavy psds, animation, video editing etc",1,0
i need big keys for my big fingers.,1,0
i am planning to buy a laptop for my son and he wants it to be lightweight and nice looking.,1,0
my dream computer is a powerful laptop.,1,0
i need some recommendations on a cheap computer which is easy to use and able to run smoothly.,1,0
i am getting a new computer with impressing specs to play games well.,1,0
i need some good specs on the computer for my business.,1,0
i am finding a computer with great price.,1,0
i need a fast computer to get my things done quickly.,1,0
i want a fast computer with a reasonable price.,1,0
"i don't do gaming so i just need a nice, clear touchscreen.",1,0
my old computer just died and i need one that startup smoothly.,1,0
i surf the internet all day and i am finding a new laptop that do fast in that.,1,0
i do wish that there was a windows hello enabled camera or a fingerprint reader.,1,0
even wish it was to full keyboard with this number pad to my right,1,0
i am purchasing a new computer and i want it to have good hinges because i broke those of my last computer.,1,0
"i spent a long time when i find the sacred three-in-one integration of the game laptop: thin, powerful, battery life.",1,0
"i am a serious game player, so the hardware must be the top trap.",1,0
i ' m a serious gamer so the hardware gotta personify top notch,1,0
i want a fast computer with a nice fingerprint scanner to accelerate.,1,0
i am in need of a new computer that is fast and slim.,1,0
i need the computer to have a clean resolution and audio.,1,0
"i need a new laptop for work and it should be affordable, fast and sleek.",1,0
i am finding a work only computer that is fast and has plenty of memory.,1,0
if aorus offers two ac adapters to end user will be fantastic!!,1,0
i don't want to have much bloatware on my computer.,1,0
i am looking for a computer that play games well with a reasonable price.,1,0
i go on a lot of business travell so what i need is a computer that is light and doesn't take up much space.,1,0
i need a computer that is light and start up fast.,1,0
i enjoy gaming and i am finding a laptop that perform well in that.,1,0
my old computer is too slow and heavy so i need a new one.,1,0
i would have no complaints as long as the new computer would start up in seconds.,1,0
i'm an it student and i need a computer that looks cool.,1,0
"i run without riding workloads, so i run a fast machine with full army eye.",1,0
"i need some small work and travel, but i am strong enough to do light games, it is best to be heavy.",1,0
one was search for a laptop computer that would see my needs for gaming and get the battery life to take on the fling to suffice school work,1,0
i love computer with great design.,1,0
my old computer needs replacement and the new one should be fast and has a perfect size.,1,0
i be looking for a lightweight laptop that is good for gaming.,1,0
quite suppose i would have stayed happier with the bigger screen.,1,0
my old laptop is not working and i am finding a new one that has good amount of ram and storage.,1,0
i need a handy computer.,1,0
i have been working in the computer industry and i am finding myself a computer with nice build quality and nice finish.,1,0
my daughter does a lot of drawing on her tablet and she needs a handy one with rich colours shown on the screen.,1,0
i did a lot of research and found out having a sharp display is critical to me.,1,0
i need a fast computer.,1,0
i need a functional yet inexpensive model.,1,0
a touch screen would make nice,1,0
i need a quiet computer with high performance-cost ratio.,1,0
i hope there are more ports.,1,0
i am trying to find a gaming laptop that goes really fast.,1,0
"i wanted something to replace my college laptop (a big, heavy 16 "" dell with an i5 central processing unit) that could handle overwatch at its gamy settings while still maintaining its ability to follow a professional take care laptop computer.",1,0
i need a fast computer.,1,0
i don’t want my current computer anymore and i am looking for a new one coming with the perfect keyboard and screen.,1,0
someone wanted a laptop with better hardware and special looks at a lower price.,1,0
a fast computer would be preferrable.,1,0
i believe i would left labelled happier with the bigger screen.,1,0
i wish it doc concluded with at littlest a 500gb ssd since the space on this will becomes finalised up shortly,1,0
i want a light computer.,1,0
a fast computer with a great screen resolution is what i need.,1,0
speed is important for my computer.,1,0
it could ' ve equal actually prissy if it had double slots for the repositing.,1,0
i lost my old taplet so i am finding for a new one that show awesome graphics.,1,0
i play counter-strike: global offensive and having a laptop with a high refresh rate screen was very important for me.,1,0
i am coming from a high end pc and i need a laptop that plays games well.,1,0
i think the fingerprint scanner were a bit bit more time,1,0
my old tablet finally died and i need a new one that comes with the right price.,1,0
i need a new computer to support my work that is solidly built with low cost.,1,0
i am looking for a working laptop for myself and it should look good with a good feel of keyboard.,1,0
i am taking the laptop to school and i want it to have a good selection of ports for my use.,1,0
wish it for another level 3 port,1,0
"the computer i want should startup fast, cool and quietly.",1,0
i need a quick and responsive computer.,1,0
"i didn ' t want anything bulky or screaming "" gaming laptop computer "" as i arrange other things than simply bet on like video editing, photo editing, web design, virtualization, etc. as my married woman calls it, "" nerd stuff and nonsense "".",1,0
i am looking for myself a work station but can run lots of games with a good price.,1,0
"i will be using the laptop for work so it should be sleek, lightweight and easy to setup.",1,0
i need the processor to be fast and responsive on my next computer.,1,0
i have some criteria for my dream computer.,1,0
my current computer is not keeping up with my expectation so i need a new computer with a high performance-cost ratio.,1,0
"i warranted a new machinery that enabled lighter, had enhancement battery lifetime and participated just as powerful for my gaming needs",1,0
"i necessitate thing small scale for work and travelling, but strong sufficiently to do light gambling, preferably heavy gaming.",1,0
i want to find the best computer with my limited budget.,1,0
i need a computer that comes with a high performance-cost ratio.,1,0
i am finding a new gaming computer for myself and i want it to be fast and upgradeable.,1,0
"i liked anything to replace my college notebook (a great, heavy 16 "" dell with an i5 processor) that could administering overwatch at its high settings whereas still implementing its capacity to be a occupational overlooking laptop.",1,0
i am becoming a coder and i need a new computer that is sleek and has large storage space.,1,0
"i wanted a new machine that was lighter, had better electric battery life and was just equally powerful for my gambling want",1,0
i skype with my friends so i need a good sound output so i hear them clearly.,1,0
"i need a computer which include a cd drive and run fast with wifi, and of course the price should be reasonable.",1,0
i need a computer that can play games fast and smoothly.,1,0
"i need a new computer that is lightweight, quiet and fast.",1,0
i need a new computer that is fast and economical.,1,0
i am finding myself a great computer that is solid and priced greatly.,1,0
i am trying to find a new gaming laptop that plays my games fast and quietly.,1,0
i play tons of games and i am finding one that has good keyboard and trackpad and screen.,1,0
i like sleek looking computer.,1,0
"i need a computer that runs silently with a good battery life, also it should stay within my budget.",1,0
i would use the computer for engineering purposes and it should be good looking and affordable.,1,0
"for a gamer, i need excellent graphics while running my games.",1,0
i want to get to use the computer as soon as possible so it's better to have some pre-loaded software.,1,0
i am looking for a new computer that has a sharp screen and a fast hard drive.,1,0
i am finding the best computer with the most reasonable price that can run games smoothly.,1,0
i am finding myself a perfect gaming laptop.,1,0
i need a computer with a high performance-cost ratio and a large memory.,1,0
i have some expectations on my new computer that it should have a good processor with enough ram.,1,0
i hoping the fingerprint scan approximately a tad bit more sensitive,1,0
"as a person who is into light gaming and video editing, i need a computer that goes perfect for both the aspect.",1,0
it could ' ve been truly lovely if it had doubles slots for the stores.,1,0
my old computer doesn't work for me anymore and i need a fast one with lots of space.,1,0
i am considering to change my old computer and the new one should be sleek.,1,0
a backup laptop is needed and i hope it comes with great specs with low cost.,1,0
i need a fast computer.,1,0
i have a number of files that need good memory to store them.,1,0
my wife needs a laptop for studying and she wants it to boot up fast and last long with a low cost.,1,0
i am planning to find a new laptop that has a good processor and build well.,1,0
i am a student so i need a computer that come with the perfect size and run games well.,1,0
i would look carefully with all the specs that come with the computer and i want it to boot up fast with a great price.,1,0
i don't want the new computer to constantly lag as my previous computer.,1,0
a good hard disk with a reasonable price is what i need.,1,0
my old computer is not working and i need a new with good size and colour.,1,0
i want to have a new computer that handles games well and boots up quickly.,1,0
i hoping it don come with at littlest a 500gb ssd since the space on this will became implemented up quickly,1,0
"i want to upgrade my old computer that i want a faster, lighter and more attractive model.",1,0
i am trying to find a new computer that is reasonably priced.,1,0
i hope i can afford a fast computer.,1,0
i am not having much money at the moment and what i need is a computer with a reasonable price.,1,0
i believe i would involved... happier with the bigger screen.,1,0
i expect to see some good pictures on the screen.,1,0
i am replacing my old computer that i want a full sized keyboard with a number pad.,1,0
i don't want the computer to be heavy or look dull.,1,0
"she needed something small for peace and travel, not strong enough to do paper gaming, or board gaming.",1,0
i will need a functional computer.,1,0
my work requires for a better computer that comes with a sturdy keyboard with useful backlighting.,1,0
wish had had that dedicated thunderbolt port instead over that mini display port,1,0
i got many good years on my old computer and now i am changing to a faster model with a good touch screen and a good screen size.,1,0
i am a video editor and i need a good looking computer.,1,0
a computer with high performance-cost ratio is what i need.,1,0
"i don't have much requirement for my new computer, it just need to be cheap.",1,0
my old laptop has a broken screen and i want a more good looking one.,1,0
i do virtualisation on my computer so i need a responsive laptop.,1,0
price is what i concern when purchasing a new computer.,1,0
i am a software developer and i am finding a new computer that can run idss with no glitch in a low cost.,1,0
"i needed a small durable laptop that can handle lots of artboards, heavy psds, animation, video editing etc",1,0
i want to buy a new laptop so i can share it with my wife.,1,0
i am replacing my old computer and i want a lighter and more sturdy one.,1,0
i hope it has a little internal storage,1,0
i am looking for a computer that will boot fast and play games with ease.,1,0
i am finding myself a fast computer.,1,0
i want to change my old computer and i am finding a new one that is nice looking and has nice backlit keys.,1,0
my old computer doesn't work for me anymore so i need a new one with decent touch screen and sound.,1,0
i want to computer to have a low price.,1,0
i am finding a fantastic bargain for my gaming computer.,1,0
i need the computer to be light enough that i can carry it around.,1,0
i am finding my first laptop in college and i need it to have excellent visual fidelity and a full keyboard.,1,0
i need a fast computer.,1,0
i am buying a laptop for my son so that he can play games with no problem.,1,0
information technology would have be ergonomically nice to get had the flexibility to plug in either the left operating theater right english for charging.,1,0
i have limited budget and i am finding a computer with fast fingerprint sensor and awesome battery life.,1,0
i need a good recommendation on a easy-to-set-up computer with not much bloatware.,1,0
i expect my new computer will be fast and reasonably priced.,1,0
"my old computer needs replacement and i want the new computer to come with a quiet keyboard and well spaced, sized keys.",1,0
"i want to have a new computer that is lightweight, solid and has good specs.",1,0
i am replacing an old computer and the new one should come with great price.,1,0
